{"action_conversion":"absolute_xyz_rpy_gripper_to_ee8_wxyz_v1","action_execution":"full_20_step_chunk_then_reinfer_v1","action_horizon":20,"benchmark_action_dim":8,"bundle_root":"/absolute/RoboTactile/deployment/artifacts/models/dream_tac","camera_mapping":"top_cam_front__wrist_l_cam_high_v1","casa_inference_contract":"upstream_http_gate_missing_v1","checkpoint_files":[{"path":"model.pt","sha256":"0000000000000000000000000000000000000000000000000000000000000000"}],"checkpoint_root":"/absolute/RoboTactile/deployment/artifacts/models/dream_tac/checkpoint","checkpoint_tree_sha256":"ab96960bba4d64a1911a32ad77d988ccfe705bb6dce7c898fbbc9eff256871c6","color_contract":"uint8_hwc_rgb_png_v1","control_hz":20.0,"dataset_stats_path":"/absolute/RoboTactile/deployment/artifacts/models/dream_tac/dataset_statistics_franka.json","dataset_stats_sha256":"0000000000000000000000000000000000000000000000000000000000000000","experiment_config":"cosmos_predict2_2b_480p_franka_pick_and_place_baguette","external_commit":"14bab51d6862fd07124745c55cd395ea5caa9fd3","gripper_mapping":"greater_than_threshold_is_closed_v1","gripper_threshold":0.5,"image_size":224,"instruction":"Pick up the baguette.","proprio_contract":"ee8_wxyz_to_xyz_rpy_v1","quaternion_order":"wxyz","raw_action_dim":7,"schema_version":"robotactile-dream-tac-artifact-v1","server_protocol":"dream-tac-franka-http-v1","state_dim":6,"t5_embeddings_path":"/absolute/RoboTactile/deployment/artifacts/models/dream_tac/t5_embeddings.pkl","t5_embeddings_sha256":"0000000000000000000000000000000000000000000000000000000000000000","tactile_contract":"delivered_left_right_rgb_required_v1","task_id":"custom_franka_pick_baguette","use_tactile":true,"weight_release_status":"user_supplied_unverified"}
